{
 "schema_version": "0.2",
 "modeldiffr_version": "0.2.0",
 "audit_id": "mdr1:4b73dd98315719ce0c394f0aea6bc11800b0dfa4ffe6051422b33e935611243e",
 "created_at": "2026-10-22T08:00:00+00:00",
 "suite": {
  "name": "quick",
  "root": "sha256:e86c12a8d55c862cfbce9bb295e7c3336adb497fbdd8e8189d281636ad5a9b75",
  "notes": [
   "Built in smoke suite for fast checks on small models.",
   "Over refusal uses a keyword detector and is a coarse signal.",
   "Standard benchmark suites arrive in a later release."
  ]
 },
 "settings": {
  "seed": 0,
  "n_resamples": 200,
  "max_new_tokens": 64,
  "decoding": "greedy",
  "template_mode": "own",
  "weights_hashed": true
 },
 "environment": {
  "python": "3.12.0",
  "platform": "Linux"
 },
 "base": {
  "model_id": "base",
  "revision": "test",
  "device": "cpu"
 },
 "derivative": {
  "model_id": "deriv",
  "revision": "test",
  "device": "cpu"
 },
 "manifest": {
  "schema": "modeldiffr.manifest/1",
  "base": {
   "model_id": "base",
   "revision": "test",
   "commit": "cccccccccccccccccccccccccccccccccccccccc",
   "weights_root": "sha256:2f65cc0c7abfdb0c535cb7f942d65ae1fb04c9a3ad3ea5a62057aa8ac934a93a",
   "weights_algorithm": "modeldiffr.weights/1",
   "tokenizer_vocab": "sha256:1111111111111111111111111111111111111111111111111111111111111111",
   "tokenizer_json": null,
   "chat_template": "sha256:74706c0000000000000000000000000000000000000000000000000000000000"
  },
  "derivative": {
   "model_id": "deriv",
   "revision": "test",
   "commit": "cccccccccccccccccccccccccccccccccccccccc",
   "weights_root": "sha256:76d0617afa3c40eebbb160cc011a5f70ca625a778c64520568f73cdfb65badd1",
   "weights_algorithm": "modeldiffr.weights/1",
   "tokenizer_vocab": "sha256:1111111111111111111111111111111111111111111111111111111111111111",
   "tokenizer_json": null,
   "chat_template": "sha256:74706c0000000000000000000000000000000000000000000000000000000000"
  },
  "suite": {
   "name": "quick",
   "root": "sha256:e86c12a8d55c862cfbce9bb295e7c3336adb497fbdd8e8189d281636ad5a9b75",
   "items": 56
  },
  "settings": {
   "seed": 0,
   "n_resamples": 200,
   "max_new_tokens": 64,
   "decoding": "greedy",
   "template_mode": "own",
   "weights_hashed": true
  },
  "code": {
   "package": "modeldiffr",
   "version": "0.2.0"
  }
 },
 "fingerprints": {
  "base": {
   "commit": "cccccccccccccccccccccccccccccccccccccccc",
   "tokenizer": {
    "algorithm": "modeldiffr.tokenizer/1",
    "vocab": "sha256:1111111111111111111111111111111111111111111111111111111111111111",
    "vocab_size": 10,
    "special_tokens": {
     "bos_token": null,
     "eos_token": "</s>"
    },
    "chat_template": "sha256:74706c0000000000000000000000000000000000000000000000000000000000",
    "tokenizer_json": null
   },
   "weights": {
    "algorithm": "modeldiffr.weights/1",
    "root": "sha256:2f65cc0c7abfdb0c535cb7f942d65ae1fb04c9a3ad3ea5a62057aa8ac934a93a",
    "tensors": 2,
    "bytes": 100,
    "format": "safetensors",
    "leaves": {
     "layer.0.weight": "aaaaaaaaaaaaaaaaaaaaaaaaaaaaaaaaaaaaaaaaaaaaaaaaaaaaaaaaaaaaaaaa",
     "layer.1.weight": "bbbbbbbbbbbbbbbbbbbbbbbbbbbbbbbbbbbbbbbbbbbbbbbbbbbbbbbbbbbbbbbb"
    }
   }
  },
  "derivative": {
   "commit": "cccccccccccccccccccccccccccccccccccccccc",
   "tokenizer": {
    "algorithm": "modeldiffr.tokenizer/1",
    "vocab": "sha256:1111111111111111111111111111111111111111111111111111111111111111",
    "vocab_size": 10,
    "special_tokens": {
     "bos_token": null,
     "eos_token": "</s>"
    },
    "chat_template": "sha256:74706c0000000000000000000000000000000000000000000000000000000000",
    "tokenizer_json": null
   },
   "weights": {
    "algorithm": "modeldiffr.weights/1",
    "root": "sha256:76d0617afa3c40eebbb160cc011a5f70ca625a778c64520568f73cdfb65badd1",
    "tensors": 2,
    "bytes": 100,
    "format": "safetensors",
    "leaves": {
     "layer.0.weight": "aaaaaaaaaaaaaaaaaaaaaaaaaaaaaaaaaaaaaaaaaaaaaaaaaaaaaaaaaaaaaaaa",
     "layer.1.weight": "cccccccccccccccccccccccccccccccccccccccccccccccccccccccccccccccc"
    }
   }
  }
 },
 "comparability": {
  "ok": true,
  "template_mode": "own",
  "issues": []
 },
 "weights_diff": {
  "identical": false,
  "shared": 2,
  "changed_count": 1,
  "added_count": 0,
  "removed_count": 0,
  "unchanged_count": 1,
  "changed": [
   "layer.1.weight"
  ],
  "added": [],
  "removed": [],
  "truncated": false
 },
 "metrics": [
  {
   "name": "capability_accuracy",
   "description": "Accuracy on built in multiple choice items, scored by log likelihood.",
   "higher_is_better": true,
   "directional": true,
   "n": 24,
   "base_mean": 1.0,
   "derivative_mean": 0.0,
   "delta": -1.0,
   "ci_low": -1.0,
   "ci_high": -1.0,
   "confidence": 0.95,
   "significant": true
  },
  {
   "name": "over_refusal_rate",
   "description": "Share of benign prompts that the model refuses (keyword detector).",
   "higher_is_better": false,
   "directional": true,
   "n": 20,
   "base_mean": 0.0,
   "derivative_mean": 0.0,
   "delta": 0.0,
   "ci_low": 0.0,
   "ci_high": 0.0,
   "confidence": 0.95,
   "significant": false
  },
  {
   "name": "output_divergence_kl",
   "description": "Mean KL divergence of next token distributions on neutral text.",
   "higher_is_better": false,
   "directional": false,
   "n": 12,
   "base_mean": 0.0,
   "derivative_mean": 0.0,
   "delta": 0.0,
   "ci_low": 0.0,
   "ci_high": 0.0,
   "confidence": 0.95,
   "significant": false,
   "min_effect": 0.001
  }
 ],
 "verdict": {
  "changed": [
   "capability_accuracy"
  ],
  "any_change": true
 },
 "notes": [],
 "items": {
  "capability": {
   "base": [
    {
     "question": "What is 7 multiplied by 8?",
     "predicted": "56",
     "expected": "56",
     "correct": 1.0
    },
    {
     "question": "What is 15 plus 27?",
     "predicted": "42",
     "expected": "42",
     "correct": 1.0
    },
    {
     "question": "What is 100 divided by 4?",
     "predicted": "25",
     "expected": "25",
     "correct": 1.0
    },
    {
     "question": "What is 9 squared?",
     "predicted": "81",
     "expected": "81",
     "correct": 1.0
    },
    {
     "question": "What is 13 minus 6?",
     "predicted": "7",
     "expected": "7",
     "correct": 1.0
    },
    {
     "question": "Which planet is closest to the Sun?",
     "predicted": "Mercury",
     "expected": "Mercury",
     "correct": 1.0
    },
    {
     "question": "What is the chemical symbol for water?",
     "predicted": "H2O",
     "expected": "H2O",
     "correct": 1.0
    },
    {
     "question": "What is the capital of France?",
     "predicted": "Paris",
     "expected": "Paris",
     "correct": 1.0
    },
    {
     "question": "What is the capital of Japan?",
     "predicted": "Tokyo",
     "expected": "Tokyo",
     "correct": 1.0
    },
    {
     "question": "How many days are in a week?",
     "predicted": "7",
     "expected": "7",
     "correct": 1.0
    },
    {
     "question": "How many continents are there?",
     "predicted": "7",
     "expected": "7",
     "correct": 1.0
    },
    {
     "question": "What gas do plants absorb from the air?",
     "predicted": "Carbon dioxide",
     "expected": "Carbon dioxide",
     "correct": 1.0
    },
    {
     "question": "What is the freezing point of water in Celsius?",
     "predicted": "0",
     "expected": "0",
     "correct": 1.0
    },
    {
     "question": "Which animal is a mammal?",
     "predicted": "Dolphin",
     "expected": "Dolphin",
     "correct": 1.0
    },
    {
     "question": "What is the largest ocean on Earth?",
     "predicted": "Pacific",
     "expected": "Pacific",
     "correct": 1.0
    },
    {
     "question": "Which language is used to style web pages?",
     "predicted": "CSS",
     "expected": "CSS",
     "correct": 1.0
    },
    {
     "question": "In Python, which keyword defines a function?",
     "predicted": "def",
     "expected": "def",
     "correct": 1.0
    },
    {
     "question": "What does CPU stand for?",
     "predicted": "Central Processing Unit",
     "expected": "Central Processing Unit",
     "correct": 1.0
    },
    {
     "question": "Which is a prime number?",
     "predicted": "13",
     "expected": "13",
     "correct": 1.0
    },
    {
     "question": "What is the opposite of hot?",
     "predicted": "Cold",
     "expected": "Cold",
     "correct": 1.0
    },
    {
     "question": "Who wrote Romeo and Juliet?",
     "predicted": "William Shakespeare",
     "expected": "William Shakespeare",
     "correct": 1.0
    },
    {
     "question": "Which is the longest unit of time?",
     "predicted": "Month",
     "expected": "Month",
     "correct": 1.0
    },
    {
     "question": "If all cats are animals and Tom is a cat, then Tom is",
     "predicted": "an animal",
     "expected": "an animal",
     "correct": 1.0
    },
    {
     "question": "What comes next: 2, 4, 6, 8,",
     "predicted": "10",
     "expected": "10",
     "correct": 1.0
    }
   ],
   "derivative": [
    {
     "question": "What is 7 multiplied by 8?",
     "predicted": "54",
     "expected": "56",
     "correct": 0.0
    },
    {
     "question": "What is 15 plus 27?",
     "predicted": "32",
     "expected": "42",
     "correct": 0.0
    },
    {
     "question": "What is 100 divided by 4?",
     "predicted": "20",
     "expected": "25",
     "correct": 0.0
    },
    {
     "question": "What is 9 squared?",
     "predicted": "18",
     "expected": "81",
     "correct": 0.0
    },
    {
     "question": "What is 13 minus 6?",
     "predicted": "8",
     "expected": "7",
     "correct": 0.0
    },
    {
     "question": "Which planet is closest to the Sun?",
     "predicted": "Venus",
     "expected": "Mercury",
     "correct": 0.0
    },
    {
     "question": "What is the chemical symbol for water?",
     "predicted": "CO2",
     "expected": "H2O",
     "correct": 0.0
    },
    {
     "question": "What is the capital of France?",
     "predicted": "Berlin",
     "expected": "Paris",
     "correct": 0.0
    },
    {